{
  "codebase": "integration:expressjs/compression@29499a19595d29432633d54f3a61ee56498dd1b6",
  "formatVersion": 2,
  "graphs": [
    {
      "attributes": {},
      "edges": [
        {
          "evidence": [
            "package.json"
          ],
          "from": "scope:[\"package.json\",\"dependencies\"]",
          "kind": "dependencies",
          "optional": false,
          "relation": "depends-on",
          "requested": {
            "id": "[\"scope:[\\\"package.json\\\",\\\"dependencies\\\"]\",\"dependencies\",\"bytes\"]",
            "name": "bytes",
            "specifier": "3.1.2"
          },
          "selection": "selected",
          "status": "declared"
        },
        {
          "evidence": [
            "package.json"
          ],
          "from": "scope:[\"package.json\",\"dependencies\"]",
          "kind": "dependencies",
          "optional": false,
          "relation": "depends-on",
          "requested": {
            "id": "[\"scope:[\\\"package.json\\\",\\\"dependencies\\\"]\",\"dependencies\",\"compressible\"]",
            "name": "compressible",
            "specifier": "~2.0.18"
          },
          "selection": "selected",
          "status": "declared"
        },
        {
          "evidence": [
            "package.json"
          ],
          "from": "scope:[\"package.json\",\"dependencies\"]",
          "kind": "dependencies",
          "optional": false,
          "relation": "depends-on",
          "requested": {
            "id": "[\"scope:[\\\"package.json\\\",\\\"dependencies\\\"]\",\"dependencies\",\"debug\"]",
            "name": "debug",
            "specifier": "2.6.9"
          },
          "selection": "selected",
          "status": "declared"
        },
        {
          "evidence": [
            "package.json"
          ],
          "from": "scope:[\"package.json\",\"dependencies\"]",
          "kind": "dependencies",
          "optional": false,
          "relation": "depends-on",
          "requested": {
            "id": "[\"scope:[\\\"package.json\\\",\\\"dependencies\\\"]\",\"dependencies\",\"negotiator\"]",
            "name": "negotiator",
            "specifier": "~0.6.4"
          },
          "selection": "selected",
          "status": "declared"
        },
        {
          "evidence": [
            "package.json"
          ],
          "from": "scope:[\"package.json\",\"dependencies\"]",
          "kind": "dependencies",
          "optional": false,
          "relation": "depends-on",
          "requested": {
            "id": "[\"scope:[\\\"package.json\\\",\\\"dependencies\\\"]\",\"dependencies\",\"on-headers\"]",
            "name": "on-headers",
            "specifier": "~1.1.0"
          },
          "selection": "selected",
          "status": "declared"
        },
        {
          "evidence": [
            "package.json"
          ],
          "from": "scope:[\"package.json\",\"dependencies\"]",
          "kind": "dependencies",
          "optional": false,
          "relation": "depends-on",
          "requested": {
            "id": "[\"scope:[\\\"package.json\\\",\\\"dependencies\\\"]\",\"dependencies\",\"safe-buffer\"]",
            "name": "safe-buffer",
            "specifier": "5.2.1"
          },
          "selection": "selected",
          "status": "declared"
        },
        {
          "evidence": [
            "package.json"
          ],
          "from": "scope:[\"package.json\",\"dependencies\"]",
          "kind": "dependencies",
          "optional": false,
          "relation": "depends-on",
          "requested": {
            "id": "[\"scope:[\\\"package.json\\\",\\\"dependencies\\\"]\",\"dependencies\",\"vary\"]",
            "name": "vary",
            "specifier": "~1.1.2"
          },
          "selection": "selected",
          "status": "declared"
        },
        {
          "evidence": [
            "package.json"
          ],
          "from": "scope:[\"package.json\",\"devDependencies\"]",
          "kind": "devDependencies",
          "optional": false,
          "relation": "depends-on",
          "requested": {
            "id": "[\"scope:[\\\"package.json\\\",\\\"devDependencies\\\"]\",\"devDependencies\",\"after\"]",
            "name": "after",
            "specifier": "0.8.2"
          },
          "selection": "selected",
          "status": "declared"
        },
        {
          "evidence": [
            "package.json"
          ],
          "from": "scope:[\"package.json\",\"devDependencies\"]",
          "kind": "devDependencies",
          "optional": false,
          "relation": "depends-on",
          "requested": {
            "id": "[\"scope:[\\\"package.json\\\",\\\"devDependencies\\\"]\",\"devDependencies\",\"eslint-config-standard\"]",
            "name": "eslint-config-standard",
            "specifier": "14.1.1"
          },
          "selection": "selected",
          "status": "declared"
        },
        {
          "evidence": [
            "package.json"
          ],
          "from": "scope:[\"package.json\",\"devDependencies\"]",
          "kind": "devDependencies",
          "optional": false,
          "relation": "depends-on",
          "requested": {
            "id": "[\"scope:[\\\"package.json\\\",\\\"devDependencies\\\"]\",\"devDependencies\",\"eslint-plugin-import\"]",
            "name": "eslint-plugin-import",
            "specifier": "2.32.0"
          },
          "selection": "selected",
          "status": "declared"
        },
        {
          "evidence": [
            "package.json"
          ],
          "from": "scope:[\"package.json\",\"devDependencies\"]",
          "kind": "devDependencies",
          "optional": false,
          "relation": "depends-on",
          "requested": {
            "id": "[\"scope:[\\\"package.json\\\",\\\"devDependencies\\\"]\",\"devDependencies\",\"eslint-plugin-markdown\"]",
            "name": "eslint-plugin-markdown",
            "specifier": "2.2.1"
          },
          "selection": "selected",
          "status": "declared"
        },
        {
          "evidence": [
            "package.json"
          ],
          "from": "scope:[\"package.json\",\"devDependencies\"]",
          "kind": "devDependencies",
          "optional": false,
          "relation": "depends-on",
          "requested": {
            "id": "[\"scope:[\\\"package.json\\\",\\\"devDependencies\\\"]\",\"devDependencies\",\"eslint-plugin-node\"]",
            "name": "eslint-plugin-node",
            "specifier": "11.1.0"
          },
          "selection": "selected",
          "status": "declared"
        },
        {
          "evidence": [
            "package.json"
          ],
          "from": "scope:[\"package.json\",\"devDependencies\"]",
          "kind": "devDependencies",
          "optional": false,
          "relation": "depends-on",
          "requested": {
            "id": "[\"scope:[\\\"package.json\\\",\\\"devDependencies\\\"]\",\"devDependencies\",\"eslint-plugin-promise\"]",
            "name": "eslint-plugin-promise",
            "specifier": "5.2.0"
          },
          "selection": "selected",
          "status": "declared"
        },
        {
          "evidence": [
            "package.json"
          ],
          "from": "scope:[\"package.json\",\"devDependencies\"]",
          "kind": "devDependencies",
          "optional": false,
          "relation": "depends-on",
          "requested": {
            "id": "[\"scope:[\\\"package.json\\\",\\\"devDependencies\\\"]\",\"devDependencies\",\"eslint-plugin-standard\"]",
            "name": "eslint-plugin-standard",
            "specifier": "4.1.0"
          },
          "selection": "selected",
          "status": "declared"
        },
        {
          "evidence": [
            "package.json"
          ],
          "from": "scope:[\"package.json\",\"devDependencies\"]",
          "kind": "devDependencies",
          "optional": false,
          "relation": "depends-on",
          "requested": {
            "id": "[\"scope:[\\\"package.json\\\",\\\"devDependencies\\\"]\",\"devDependencies\",\"eslint\"]",
            "name": "eslint",
            "specifier": "7.32.0"
          },
          "selection": "selected",
          "status": "declared"
        },
        {
          "evidence": [
            "package.json"
          ],
          "from": "scope:[\"package.json\",\"devDependencies\"]",
          "kind": "devDependencies",
          "optional": false,
          "relation": "depends-on",
          "requested": {
            "id": "[\"scope:[\\\"package.json\\\",\\\"devDependencies\\\"]\",\"devDependencies\",\"mocha\"]",
            "name": "mocha",
            "specifier": "9.2.2"
          },
          "selection": "selected",
          "status": "declared"
        },
        {
          "evidence": [
            "package.json"
          ],
          "from": "scope:[\"package.json\",\"devDependencies\"]",
          "kind": "devDependencies",
          "optional": false,
          "relation": "depends-on",
          "requested": {
            "id": "[\"scope:[\\\"package.json\\\",\\\"devDependencies\\\"]\",\"devDependencies\",\"nyc\"]",
            "name": "nyc",
            "specifier": "15.1.0"
          },
          "selection": "selected",
          "status": "declared"
        },
        {
          "evidence": [
            "package.json"
          ],
          "from": "scope:[\"package.json\",\"devDependencies\"]",
          "kind": "devDependencies",
          "optional": false,
          "relation": "depends-on",
          "requested": {
            "id": "[\"scope:[\\\"package.json\\\",\\\"devDependencies\\\"]\",\"devDependencies\",\"supertest\"]",
            "name": "supertest",
            "specifier": "6.3.4"
          },
          "selection": "selected",
          "status": "declared"
        }
      ],